<!ELEMENT names (name*)>
<!ELEMENT name (last_name | (first_name, ((middle_name+, last_name) | last_name?)))>
<!ELEMENT first_name (#PCDATA)>
<!ELEMENT last_name (#PCDATA)>
<!ELEMENT middle_name (#PCDATA)>
